[
  {
    "id": "cursor",
    "name": "Cursor",
    "category": "ide",
    "description": "AI-first code editor with whole-project awareness, tab completion and a multi-file agent.",
    "free_limit": "Hobby plan: limited agent requests + 2,000 tab completions/month",
    "requires_card": false,
    "open_source": false,
    "platforms": [
      "macos",
      "windows",
      "linux"
    ],
    "url": "https://cursor.com",
    "tags": [
      "coding-agent",
      "ide",
      "commercial"
    ],
    "verified": "2026-09-24",
    "verified_by": "@seed-import",
    "status": "active",
    "notes": "Free tier is an evaluation budget, not a workflow. Pair it with Gemini CLI or Cline for the heavy lifting."
  },
  {
    "id": "devin-desktop",
    "name": "Devin Desktop (formerly Windsurf)",
    "category": "ide",
    "description": "Agentic editor from Cognition — the Windsurf/Cascade lineage, renamed after the 2026 acquisition.",
    "free_limit": "Free plan: unlimited tab completion, quota-limited Cascade agent sessions",
    "requires_card": false,
    "open_source": false,
    "platforms": [
      "macos",
      "windows",
      "linux"
    ],
    "url": "https://devin.ai/desktop",
    "tags": [
      "coding-agent",
      "ide",
      "unlimited-completions"
    ],
    "verified": "2026-09-24",
    "verified_by": "@seed-import",
    "status": "active",
    "notes": "windsurf.com now redirects to devin.ai. Tab completion is unlimited on every plan, including free — the agent quota is what runs out."
  },
  {
    "id": "github-copilot",
    "name": "GitHub Copilot Free",
    "category": "ide",
    "description": "Copilot's genuinely free tier inside VS Code, JetBrains and the GitHub web editor.",
    "free_limit": "2,000 completions + 50 chat/agent requests per month",
    "requires_card": false,
    "open_source": false,
    "platforms": [
      "macos",
      "windows",
      "linux",
      "web"
    ],
    "url": "https://github.com/features/copilot",
    "tags": [
      "coding-agent",
      "completions",
      "github"
    ],
    "verified": "2026-09-24",
    "verified_by": "@seed-import",
    "status": "active",
    "notes": "Requires any GitHub account, including free. Best free choice if you already live in VS Code."
  },
  {
    "id": "zed",
    "name": "Zed",
    "category": "ide",
    "description": "Rust-native, GPU-accelerated editor with a free built-in AI tier and bring-your-own-key support.",
    "free_limit": "Free AI tier included; unlimited use with your own API keys",
    "requires_card": false,
    "open_source": true,
    "platforms": [
      "macos",
      "linux",
      "windows"
    ],
    "url": "https://zed.dev",
    "tags": [
      "ide",
      "fast",
      "open-source",
      "byok"
    ],
    "verified": "2026-09-24",
    "verified_by": "@seed-import",
    "status": "active"
  },
  {
    "id": "kiro",
    "name": "Kiro",
    "category": "ide",
    "description": "AWS's spec-driven agentic IDE — writes requirements and design docs before it writes code.",
    "free_limit": "Free tier with monthly agentic-interaction quota",
    "requires_card": false,
    "open_source": false,
    "platforms": [
      "macos",
      "windows",
      "linux"
    ],
    "url": "https://kiro.dev",
    "tags": [
      "coding-agent",
      "ide",
      "spec-driven",
      "aws"
    ],
    "verified": "2026-09-24",
    "verified_by": "@seed-import",
    "status": "active"
  },
  {
    "id": "trae",
    "name": "Trae",
    "category": "ide",
    "description": "ByteDance's AI IDE with a free tier built around frontier models and an agent mode.",
    "free_limit": "Free plan with monthly premium-model requests",
    "requires_card": false,
    "open_source": false,
    "platforms": [
      "macos",
      "windows",
      "linux"
    ],
    "url": "https://trae.ai",
    "tags": [
      "coding-agent",
      "ide",
      "free-tier"
    ],
    "verified": "2026-09-24",
    "verified_by": "@seed-import",
    "status": "active",
    "notes": "Review the data-retention policy before using it on proprietary code."
  },
  {
    "id": "amp",
    "name": "Amp (Sourcegraph)",
    "category": "cli",
    "description": "Frontier agent from Sourcegraph with a free-forever plan, then pay-as-you-go with no subscription required.",
    "free_limit": "Free plan with a monthly ad-supported allowance; BYOK option",
    "requires_card": false,
    "open_source": false,
    "platforms": [
      "macos",
      "linux",
      "windows"
    ],
    "url": "https://ampcode.com",
    "tags": [
      "coding-agent",
      "cli",
      "frontier",
      "byok"
    ],
    "verified": "2026-09-24",
    "verified_by": "@seed-import",
    "status": "active"
  },
  {
    "id": "opencode",
    "name": "OpenCode",
    "category": "cli",
    "description": "Open-source terminal coding agent with a client/server architecture and provider-agnostic model routing.",
    "free_limit": "Free software — you bring a model key (free tiers work fine)",
    "requires_card": false,
    "open_source": true,
    "platforms": [
      "macos",
      "linux",
      "windows"
    ],
    "install": "curl -fsSL https://opencode.ai/install | bash",
    "url": "https://opencode.ai",
    "tags": [
      "coding-agent",
      "cli",
      "open-source",
      "byok"
    ],
    "verified": "2026-09-24",
    "verified_by": "@seed-import",
    "status": "active"
  },
  {
    "id": "kilo-code",
    "name": "Kilo Code",
    "category": "ide",
    "description": "Open-source VS Code agent with a large free model allocation before you need your own key.",
    "free_limit": "Free credits on signup for Anthropic/Gemini models; unlimited with BYOK",
    "requires_card": false,
    "open_source": true,
    "platforms": [
      "macos",
      "windows",
      "linux"
    ],
    "url": "https://kilocode.ai",
    "tags": [
      "coding-agent",
      "vscode",
      "open-source"
    ],
    "verified": "2026-09-24",
    "verified_by": "@seed-import",
    "status": "active"
  },
  {
    "id": "gemini-cli",
    "name": "Gemini CLI",
    "category": "cli",
    "description": "Google's open-source terminal agent with the most generous free quota of any first-party CLI.",
    "free_limit": "1,000 requests/day with a personal Google account (60 RPM)",
    "requires_card": false,
    "open_source": true,
    "platforms": [
      "macos",
      "linux",
      "windows"
    ],
    "install": "npx -y @google/gemini-cli",
    "url": "https://github.com/google-gemini/gemini-cli",
    "stars": 107139,
    "tags": [
      "coding-agent",
      "cli",
      "generous-free-tier",
      "essential"
    ],
    "verified": "2026-09-24",
    "verified_by": "@seed-import",
    "status": "active",
    "notes": "Also ships a free Gemini Code Assist VS Code extension on the same account. The best $0 coding agent in 2026."
  },
  {
    "id": "qwen-code",
    "name": "Qwen Code",
    "category": "cli",
    "description": "Qwen's fork of Gemini CLI wired to Qwen3-Coder, with a large free daily request allowance via OAuth.",
    "free_limit": "~2,000 requests/day via Qwen OAuth",
    "requires_card": false,
    "open_source": true,
    "platforms": [
      "macos",
      "linux",
      "windows"
    ],
    "install": "npm install -g @qwen-code/qwen-code",
    "url": "https://github.com/QwenLM/qwen-code",
    "stars": 28109,
    "tags": [
      "coding-agent",
      "cli",
      "qwen",
      "generous-free-tier",
      "essential"
    ],
    "verified": "2026-09-24",
    "verified_by": "@seed-import",
    "status": "active",
    "notes": "Strong on large refactors thanks to Qwen3-Coder's context window. The 2,000/day figure is subject to change."
  },
  {
    "id": "aider",
    "name": "Aider",
    "category": "cli",
    "description": "Terminal pair-programmer that commits every change to git and maps your repo into the model's context.",
    "free_limit": "Free software — works with any free LLM API key",
    "requires_card": false,
    "open_source": true,
    "platforms": [
      "macos",
      "linux",
      "windows"
    ],
    "install": "pip install aider-install && aider-install",
    "url": "https://aider.chat",
    "tags": [
      "coding-agent",
      "cli",
      "git-native",
      "byok",
      "essential"
    ],
    "verified": "2026-09-24",
    "verified_by": "@seed-import",
    "status": "active"
  },
  {
    "id": "cline",
    "name": "Cline",
    "category": "ide",
    "description": "Autonomous coding agent for VS Code, JetBrains and the terminal, with human approval at every step.",
    "free_limit": "Free and open source — bring any provider key (including free tiers)",
    "requires_card": false,
    "open_source": true,
    "platforms": [
      "macos",
      "windows",
      "linux"
    ],
    "url": "https://cline.bot",
    "tags": [
      "coding-agent",
      "vscode",
      "open-source",
      "byok",
      "essential"
    ],
    "verified": "2026-09-24",
    "verified_by": "@seed-import",
    "status": "active",
    "notes": "The most flexible free setup: point it at Gemini or Groq free tiers and a full agent costs nothing."
  },
  {
    "id": "roo-code",
    "name": "Roo Code",
    "category": "ide",
    "description": "Cline fork with custom modes (architect, debugger, tester) and an orchestrator mode for multi-step work.",
    "free_limit": "Free and open source — bring any provider key",
    "requires_card": false,
    "open_source": true,
    "platforms": [
      "macos",
      "windows",
      "linux"
    ],
    "url": "https://roocode.com",
    "tags": [
      "coding-agent",
      "vscode",
      "modes",
      "byok"
    ],
    "verified": "2026-09-24",
    "verified_by": "@seed-import",
    "status": "active"
  },
  {
    "id": "continue-dev",
    "name": "Continue",
    "category": "ide",
    "description": "Open-source Copilot alternative for VS Code and JetBrains with customisable model routing.",